Name,Link,Author,Type
From Getting Started to Getting the Most out of Corona,http://beyondthetech.com/2011/04/from-getting-started-to-getting-the-most-out-of-corona/,Beyond the Tech,Blog post
Lesson 01: Getting Started,http://www.burtonsmediagroup.com/blog/2010/06/iphone-game-development-with-corona-getting-started-hello-world/,Burton's Media Group,Blog Post
Lesson 02: Working with Buttons,http://www.burtonsmediagroup.com/blog/2010/06/developing-iphoneipadandroid-games-with-corona-working-with-buttons/,Burton's Media Group,Blog Post
Lesson 03: Creating Animations,http://www.burtonsmediagroup.com/blog/2010/07/developing-iphoneipadandroid-games-with-corona-creating-animations/,Burton's Media Group,Blog Post
Lesson 04: Fade In and Fade Out,http://www.burtonsmediagroup.com/blog/2010/07/developing-iphoneipadandroid-games-with-corona-fade-in-and-fade-out/,Burton's Media Group,Blog Post
Lesson 05: Adding Sound Effects,http://www.burtonsmediagroup.com/blog/2010/07/developing-iphoneipadandroid-games-with-corona-adding-sound-effects/,Burton's Media Group,Blog Post
Lesson 06: Orientation Change,http://www.burtonsmediagroup.com/blog/2010/07/developing-iphoneipadandroid-applications-with-corona-orientation-change/,Burton's Media Group,Blog Post
Lesson 07: Developing With SQLite Database,http://www.burtonsmediagroup.com/blog/2011/02/corona-app-development-developing-with-sqlite-database/,Burton's Media Group,Blog Post
ChromaClub: Make Your Own Mobile Game in 60 Minutes,http://www.youtube.com/watch?v=TD6OlIgepCE&feature=BFp&list=PLF74515B1E922F402,Chroma Club,Video
Hidden Mobile Game Design Mechanic #97: Drawing Mechanic,http://www.youtube.com/watch?v=INLVH-uba70,Chroma Club,Video
Hidden Mobile Game Design Mechanic #48: Saving Game Content,http://www.youtube.com/watch?v=qvvMlv_pCqc&feature=plcp,Chroma Club,Video
Corona 101 - The Basics,http://vimeo.com/16824130,Corona Labs,Video
Corona 102 - Functions & Event Listeners,http://vimeo.com/17043767,Corona Labs,Video
Tutorial: Learn How to Build a Flickr Photo Browser,http://developer.anscamobile.com/code/flickr-photo-browser,Corona Labs,Forum post
Applying Basic Animation with Transition,http://blog.anscamobile.com/2012/06/applying-basic-animation-with-transitions/,Corona Labs,Blog Post
Local Notifications Guide (iOS),http://blog.anscamobile.com/2012/06/local-notifications-guide-ios/,Corona Labs,Blog Post
How to Use Bitmap Masks,http://blog.anscamobile.com/2012/05/how-to-use-bitmap-masks/,Corona Labs,Blog Post
Adding Buttons to Your Games and Apps,http://blog.anscamobile.com/2012/05/adding-buttons-to-your-games-and-apps/,Corona Labs,Blog Post
Handling Corona System Events,http://blog.anscamobile.com/2012/05/handling-corona-system-events/,Corona Labs,Blog Post
LuaFileSystem (LFS) Tutorial,http://blog.anscamobile.com/2012/05/luafilesystem-lfs-tutorial/,Corona Labs,Blog Post
Property Callbacks,http://blog.anscamobile.com/2012/05/tutorial-property-callbacks/,Corona Labs,Blog Post
Scene Overlays and Parameter Passing,http://blog.anscamobile.com/2012/04/scene-overlays-and-parameter-passing/,Corona Labs,Blog Post
Working with Time: Delays and Passing,http://blog.anscamobile.com/2012/04/working-with-time-delays-and-counting/,Corona Labs,Blog Post
"Director to Storyboard ""Transition Guide""",http://blog.anscamobile.com/2012/04/director-to-storyboard-transition-guide/,Corona Labs,Blog Post
Detecting Touches in Corona,http://blog.anscamobile.com/2012/04/corona-touch-events-tutorial/,Corona Labs,Blog Post
Database Access in Corona with SQLite,http://blog.anscamobile.com/2012/04/tutorial-database-access-in-corona/,Corona Labs,Blog Post
Storyboard Scene Events Explained,http://blog.anscamobile.com/2012/03/storyboard-scene-events-explained/,Corona Labs,Blog Post
Developing for iPad Retina Display,http://blog.anscamobile.com/2012/03/developing-for-ipad-retina-display/,Corona Labs,Blog Post
Taking Snapshots of Objects and Groups,http://blog.anscamobile.com/2012/03/taking-snapshots-of-objects-and-groups/,Corona Labs,Blog Post
Getting Started With Android In-App Billing,http://blog.anscamobile.com/2012/03/getting-started-with-android-in-app-billing/,Corona Labs,Blog Post
Reading and Writing Files in Corona,http://blog.anscamobile.com/2012/02/reading-and-writing-files-in-corona/,Corona Labs,Blog Post
Tutorial: Text Input with Native UI,http://blog.anscamobile.com/2012/02/tutorial-text-input-with-native-ui/,Corona Labs,Blog Post
Creating Lists with the TableView Widget,http://blog.anscamobile.com/2012/01/creating-lists-with-the-tableview-widget/,Corona Labs,Blog Post
Using the New Native Web and Video APIÕs,http://blog.anscamobile.com/2012/01/using-the-new-native-web-video-apis/,Corona Labs,Blog Post
Tutorial: Game Center Integration (iOS),http://blog.anscamobile.com/2012/01/tutorial-game-center-integration-ios/,Corona Labs,Blog Post
Implementing Facebook Single Sign-On,http://blog.anscamobile.com/2012/01/implementing-facebook-single-sign-on/,Corona Labs,Blog Post
Composing E-mail and SMS in Corona,http://blog.anscamobile.com/2012/01/composing-email-and-sms-in-corona/,Corona Labs,Blog Post
Using App URL Schemes in iOS,http://blog.anscamobile.com/2011/12/using-app-url-schemes-in-ios/,Corona Labs,Blog Post
Push Notifications for iOS in Corona SDK,http://blog.anscamobile.com/2011/12/push-notifications-for-ios-in-corona-sdk/,Corona Labs,Blog Post
Uploading Photos to Facebook in Corona,http://blog.anscamobile.com/2011/12/uploading-photos-to-facebook-in-corona/,Corona Labs,Blog Post
How to Create a Page Curl in Corona,http://blog.anscamobile.com/2011/12/how-to-create-a-page-curl-in-corona/,Corona Labs,Blog Post
Building and Publishing Kindle Fire Apps,http://blog.anscamobile.com/2011/11/building-and-publishing-kindle-fire-apps/,Corona Labs,Blog Post
Common Storyboard API Questions,http://blog.anscamobile.com/2011/11/common-storyboard-api-questions/,Corona Labs,Blog Post
Tutorial: Resurrect your Flash games,http://blog.anscamobile.com/2011/11/guest-post-resurrect-your-flash-games/,Corona Labs,Blog Post
Tutorial: The A* Algorithm,http://blog.anscamobile.com/2011/11/guest-post-the-a-algorithm/,Corona Labs,Blog Post
Tutorial: Modular Classes in Corona,http://blog.anscamobile.com/2011/09/tutorial-modular-classes-in-corona/,Corona Labs,Blog Post
Tutorial: How to Drag Objects,http://blog.anscamobile.com/2011/09/tutorial-how-to-drag-objects/,Corona Labs,Blog Post
How to spawn objects Ñ the right way!,http://blog.anscamobile.com/2011/09/how-to-spawn-objects-%e2%80%94-the-right-way/,Corona Labs,Blog Post
A Better Approach to External Modules,http://blog.anscamobile.com/2011/09/a-better-approach-to-external-modules/,Corona Labs,Blog Post
Corona SDK Memory Leak Prevention 101,http://blog.anscamobile.com/2011/08/corona-sdk-memory-leak-prevention-101/,Corona Labs,Blog Post
Tutorial: Simple Modular Coding Technique,http://blog.anscamobile.com/2011/08/tutorial-simple-modular-coding-technique/,Corona Labs,Blog Post
Solutions to Common Physics Challenges,http://blog.anscamobile.com/2011/08/solutions-to-common-physics-challenges/,Corona Labs,Blog Post
Tutorial: Exploring JSON Usage in Corona,http://blog.anscamobile.com/2011/08/tutorial-exploring-json-usage-in-corona/,Corona Labs,Blog Post
How to use XML files in Corona,http://blog.anscamobile.com/2011/07/how-to-use-xml-files-in-corona/,Corona Labs,Blog Post
The secret/undocumented audio APIs in Corona SDK,http://blog.anscamobile.com/2011/07/the-secretundocumented-audio-apis-in-corona-sdk/,Corona Labs,Blog Post
The Significance of Local Variables in Lua,http://blog.anscamobile.com/2011/07/local-variables-lua/,Corona Labs,Blog Post
How to Use Custom Fonts in Corona,http://blog.anscamobile.com/2011/07/custom-fonts-corona/,Corona Labs,Blog Post
Using External Modules in Corona,http://blog.anscamobile.com/2011/07/using-external-modules-in-corona/,Corona Labs,Blog Post
Understanding Lua tables in Corona SDK,http://blog.anscamobile.com/2011/06/understanding-lua-tables-in-corona-sdk/,Corona Labs,Blog Post
The Corona Event Model explained,http://blog.anscamobile.com/2011/06/the-corona-event-model-explained/,Corona Labs,Blog Post
"Tutorial: Porting ActionScript games to iOS (with Corona SDK, of course!)",http://blog.anscamobile.com/2011/06/porting-actionscript-games-to-ios-with-corona-sdk-of-course/,Corona Labs,Blog Post
Tutorial: Apple Validation with Corona SDK,http://blog.anscamobile.com/2011/05/tutorial-apple-validation-with-corona-sdk/,Corona Labs,Blog Post
Make a game in 90 minutes: ÔBalloon BurstÕ,http://blog.anscamobile.com/2011/03/make-a-game-in-90-minutes-balloon-burst/,Corona Labs,Blog Post
How to make a simple physics-based shooter game with the Corona SDK,http://blog.anscamobile.com/2011/02/how-to-make-a-simple-physics-based-shooter-game-with-the-corona-sdk/,Corona Labs,Blog Post
Corona SDK Tutorial: Make a Game in 40 Minutes,http://blog.anscamobile.com/2011/02/corona-sdk-tutorial-make-a-game-in-40-minutes/,Corona Labs,Blog Post
Corona Comics Tutorial: Coloring your artwork,http://blog.anscamobile.com/2011/02/corona-comics-tutorial-coloring-your-artwork/,Corona Labs,Blog Post
Using closures in Lua to avoid global variables for callbacks,http://blog.anscamobile.com/2011/02/using-closures-in-lua-to-avoid-global-variables-for-callbacks/,Corona Labs,Blog Post
Use dynamic layouts in universal builds with Corona SDK,http://blog.anscamobile.com/2011/01/use-dynamic-layouts-in-universal-builds-with-corona-sdk/,Corona Labs,Blog Post
Dynamic Image Resolution Made Easy,http://blog.anscamobile.com/2011/01/dynamic-image-resolution-made-easy/,Corona Labs,Blog Post
Flash to Corona SDK Porting Guide,http://blog.anscamobile.com/2011/01/flash-to-corona-porting-guide/,Corona Labs,Blog Post
Corona SDK Tutorial: Polygon point reduction with curve-fitting,http://blog.anscamobile.com/2010/12/corona-sdk-tutorial-polygon-point-reduction-with-curve-fitting/,Corona Labs,Blog Post
Corona Comics Tutorial: Inking your comic art,http://blog.anscamobile.com/2010/12/corona-comics-tutorial-inking-your-comic-art/,Corona Labs,Blog Post
Corona Comics Tutorial: Special Effects with Text,http://blog.anscamobile.com/2010/11/corona-comics-tutorial-special-effects-text/,Corona Labs,Blog Post
Corona Comics Tutorial: Word Balloons,http://blog.anscamobile.com/2010/11/corona-comics-tutorial-word-balloons/,Corona Labs,Blog Post
Introduction to Corona Comics,http://blog.anscamobile.com/2010/11/introduction-to-corona-comics/,Corona Labs,Blog Post
Tips & Tricks: Using textures for better motion,http://blog.anscamobile.com/2010/10/tips-tricks-using-textures-for-better-motion/,Corona Labs,Blog Post
Make a game in 8 minutes with Corona?,http://blog.anscamobile.com/2010/10/make-a-game-in-8-minutes-with-corona/,Corona Labs,Blog Post
Make a game in 8 minutes with Corona (Part 2),http://blog.anscamobile.com/2010/10/make-a-game-in-8-minutes-with-corona-part-2/,Corona Labs,Blog Post
Corona Tutorial: Display Objects and Texture Memory (Part 1),http://blog.anscamobile.com/2010/10/corona-tutorial-display-objects-and-texture-memory-part-1/,Corona Labs,Blog Post
Corona Tutorial: Display Objects and Texture Memory (Part 2),http://blog.anscamobile.com/2010/10/video-tutorial-display-objects-and-texture-memory-%e2%80%94-part-2/,Corona Labs,Blog Post
Combine HTML and OpenGL content seamlessly in a single app,http://blog.anscamobile.com/2010/09/opengl-and-html/,Corona Labs,Blog Post
Corona SDK Welcome Screen and Simulator Overview,http://www.youtube.com/watch?v=Voq1rMy9elU,Corona Labs,Video
Corona SDK on Windows: Getting Started,http://www.youtube.com/watch?v=vcRaabRAtXo,Corona Labs,Video
Lesson 01: Hello World,http://www.youtube.com/watch?v=W671W0QwgdQ,Corona Labs,Video
Lesson 02: Transitions,http://www.youtube.com/watch?v=bo-OPAl9O2Q,Corona Labs,Video
"Lesson 03: Gear Animation, Part 1: Rotation and Simple Animation",http://www.youtube.com/watch?v=YVRRotMYXyI,Corona Labs,Video
"Lesson 04: Gear Animation, Part 2: Rotate and Scale",http://www.youtube.com/watch?v=BOI96QtXtoU,Corona Labs,Video
"Lesson 05: Gear Animation, Part 3: Backgrounds, Buttons and More",http://www.youtube.com/watch?v=Y5Oz72MO4JI,Corona Labs,Video
"Lesson 06: Gear Animation, Part 4: Positioning, Resolution Independence",http://www.youtube.com/watch?v=vQomcSlSLKs,Corona Labs,Video
"Lesson 07: Gear Animation, Part 5: Optimizing Frame Rate",http://www.youtube.com/watch?v=tKbPr8MvVr8,Corona Labs,Video
"Lesson 08: Gear Animation, Part 6: Android Support",http://www.youtube.com/watch?v=MYIAHR1CbBs,Corona Labs,Video
Lesson 09: Using display.NewLine,http://www.youtube.com/watch?v=-zuuV8z4gVE,Corona Labs,Video
Lesson 10: Dynamic Content Scaling,http://www.youtube.com/watch?v=-yb1xLwzeJo,Corona Labs,Video
Lesson 11: Sprite Sheets,http://www.youtube.com/watch?v=6w3n8ycCZDs,Corona Labs,Video
"Lesson 12: Display Objects and Texture Memory, Part 1",http://www.youtube.com/watch?v=_oWWWueFl8I,Corona Labs,Video
"Lesson 13: Display Objects and Texture Memory, Part 2",http://www.youtube.com/watch?v=xJAIdOggcn8,Corona Labs,Video
Lesson 14: Optimized Sprite Sheets,http://www.youtube.com/watch?v=9tqRhh4C9w4,Corona Labs,Video
"Lesson 15: Make a Game in 8 Minutes, Part 1",http://www.youtube.com/watch?v=qEMGcy-mizM,Corona Labs,Video
"Lesson 16: Make a Game in 8 Minutes, Part 2",http://www.youtube.com/watch?v=Idrug4vHSgg,Corona Labs,Video
Lesson 17: Using Textures to Create Motion,http://www.youtube.com/watch?v=Evmsec7G8tQ,Corona Labs,Video
Lesson 18: Dragging Physics,http://www.youtube.com/watch?v=LoUisojkcGE,Corona Labs,Video
Lesson 19: Intro to Corona Comics,http://www.youtube.com/watch?v=7ar3dQtpR0o,Corona Labs,Video
Lesson 20: Apple Validation in Corona SDK,http://www.youtube.com/watch?v=e-hLhZISWrM,Corona Labs,Video
Lesson 21: Create a Breakout-like game with Corona SDK,http://www.youtube.com/watch?v=4ee261iYTaI,Corona Labs,Video
"VideoTutorial Corona SDK, parte 1 - Introduccion a Lua",http://www.youtube.com/watch?v=NH64be-N8Cc,erozekdkmalaga,Video
"VideoTutorial Corona SDK, parte 2 - Instalaci—n de Lua y de Corona SDK en Windows",http://www.youtube.com/watch?v=wtG2ImNXjEQ,erozekdkmalaga,Video
"VideoTutorial Corona SDK, parte 3 - Programaci—n Lua 2» parte",http://www.youtube.com/watch?v=p5mTUHUynww,erozekdkmalaga,Video
"VideoTutorial Corona SDK, parte 4 - Programaci—n Lua 3» parte",http://www.youtube.com/watch?v=07w_7HxDi-4,erozekdkmalaga,Video
"VideoTutorial Corona SDK, parte 5 - Programaci—n Lua 4» parte",http://www.youtube.com/watch?v=Q2Ze2KlGEYc,erozekdkmalaga,Video
"VideoTutorial Corona SDK, parte 6 - Programaci—n Lua 5» parte - Tables",http://www.youtube.com/watch?v=wn68PGVDR1Y,erozekdkmalaga,Video
"VideoTutorial Corona SDK, parte 7 - Programaci—n Lua 6» parte - If",http://www.youtube.com/watch?v=SK2mw8FSucg,erozekdkmalaga,Video
Create a simon game,http://gamedevnation.com/game-development/create-a-simon-game-in-corona-sdk/,GameDevNation,Blog Post
Switching Screens,http://gamedevnation.com/corona-sdk-video-tutorials/switching-screens/,GameDevNation,Video
Graphic Layout Tool,http://gamedevnation.com/corona-sdk-video-tutorials/graphics-layout-tool/,GameDevNation,Video
Using Print() From a Device [Debugging],http://gamedevnation.com/corona-sdk-video-tutorials/using-print-from-a-device-kinda/,GameDevNation,Video
Better Buttons in Corona SDK,http://instantvideowebpages.com/play/?m=645,GameDevNation,Video
Moving Sunbeams in Corona SDK,http://gamedevnation.com/game-development/moving-sunbeams-in-corona-sdk/,GameDevNation,Video
Playing with Numbers and Colors,http://gamedevnation.com/lua/playing-with-numbers-and-colors/,GameDevNation,Blog post
Shuffling Your Data,http://gamedevnation.com/lua/shuffling-your-data/,GameDevNation,Video
Create a Simon Game in Corona SDK,http://gamedevnation.com/game-development/create-a-simon-game-in-corona-sdk/,GameDevNation,Video
Shooting for Genericity: Optimizing a Lua Switch Function,http://gamedevnation.com/game-development/shooting-for-genericity/,GameDevNation,Blog post
Look for Existing Columns in a SQLite Database Table,http://gamedevnation.com/game-development/look-for-existing-columns-in-a-sqlite-database-table/,GameDevNation,Blog post
PhysicsEditor,http://gpanimations.wordpress.com/2012/05/30/physicseditor-review-tutorial/,GP Animations,Blog post
TexturePacker,http://gpanimations.wordpress.com/2012/05/29/texturepacker-review/,GP Animations,Blog post
"Corona Game Example: OOP, Scope and Box2D Collisions, Part 1",http://jessewarden.com/2011/07/corona-game-example-oop-scope-box2d-collisions-part-1.html,Jesse Warden,Blog post
Adding Achievements Using OpenFeint & Papaya Mobile,http://jessewarden.com/2011/10/adding-achievements-to-your-corona-game-or-app-using-openfeint-papaya-mobile.html,Jesse Warden,Blog post
Lua Classes and Packages in Corona,http://jessewarden.com/2011/10/lua-classes-and-packages-in-corona.html,Jesse Warden,Blog post
Make a Character Jump in Corona (Video),http://www.youtube.com/watch?v=oE_45hJVf-E&feature=youtu.be&hd=1,Jon Beebe,Video
How to Make a Simple Physics Based Shooter Game,http://karnakgames.com/wp/2011/02/how-to-make-a-simple-physics-based-shooter-game-with-the-corona-sdk/,Karnak Games,Blog post
Lesson 01: Facebook Friends Leaderboard,http://ideveloper.kodingen.com/2010/facebook-friends-leaderboard/,Kodingen,Blog Post
Lesson 02: Easy Screen Management in Corona,http://ideveloper.kodingen.com/2010/easy-screen-management-in-corona/,Kodingen,Blog Post
Lesson 03: Retina Display Setup in 3 Easy Steps,http://ideveloper.kodingen.com/2010/retina-display-setup-in-3-easy-steps/,Kodingen,Blog Post
Lesson 04: Creating a Time Counter,http://ideveloper.kodingen.com/2010/creating-a-time-counter-and-practical-usage/,Kodingen,Blog Post
Admob Ad Support in Corona,http://www.ludicroussoftware.com/blog/2010/06/03/admob-ad-support-in-corona/,Ludicrous Software,Blog Post
Table Shuffling in Lua/Corona,http://www.ludicroussoftware.com/blog/2011/01/07/table-shuffling-in-luacorona/,Ludicrous Software,Blog Post
Using SWFSheet with Corona,http://www.ludicroussoftware.com/blog/2011/01/13/using-swfsheet-with-corona/,Ludicrous Software,Blog Post
Simple OOP with Inheritance in Corona: My Approach,http://www.ludicroussoftware.com/blog/2011/07/06/simple-oop-with-inheritance-in-corona/,Ludicrous Software,Blog Post
Corona Quick Tip: Nested Block Comments,http://www.ludicroussoftware.com/blog/2011/07/08/corona-quick-tip-nested-block-comments/,Ludicrous Software,Blog Post
Custom Corona SDK Locations for Textmate Bundle,http://www.ludicroussoftware.com/blog/2011/08/03/custom-corona-sdk-locations-for-textmate-bundle/,Ludicrous Software,Blog Post
Object Oriented Function Calls in Corona,http://www.ludicroussoftware.com/blog/2011/08/10/object-oriented-function-calls-in-corona/,Ludicrous Software,Blog Post
table_AS3: AS3 Array Methods for Lua,http://www.ludicroussoftware.com/blog/2011/08/12/table_as3-as3-array-methods-for-lua/,Ludicrous Software,Blog Post
Corona Advertisement API Tutorial,http://www.ludicroussoftware.com/blog/2011/08/17/corona-ads-api-tutorial/,Ludicrous Software,Blog Post
Using the Corona Debugger,http://www.ludicroussoftware.com/blog/2011/08/22/using-the-corona-debugger/,Ludicrous Software,Blog Post
Fastest Way to Remove All Event Listeners,http://www.ludicroussoftware.com/blog/2011/08/24/remove-all-listeners/,Ludicrous Software,Blog Post
Corona Physics: Forced Horizontal/Vertical Bouncing,http://www.ludicroussoftware.com/blog/2011/09/01/corona-physics-forced-bouncing/,Ludicrous Software,Blog Post
Passing Parameters in timer.performWithDelay(),http://www.ludicroussoftware.com/blog/2011/09/05/passing-parameters-in-a-timer/,Ludicrous Software,Blog Post
Using do/end for Disposable Code,http://www.ludicroussoftware.com/blog/2011/09/21/using-do-end-for-disposable-code/,Ludicrous Software,Blog Post
Performance of Local vs. Table Functions,http://www.ludicroussoftware.com/blog/2011/11/01/local-v--table-functions/,Ludicrous Software,Blog Post
Build a Missile Command Game with Corona SDK,http://www.ludicroussoftware.com/blog/2011/11/21/build-missile-command-with-the-corona-sdk/,Ludicrous Software,Blog Post
Screencast: How to Install the Corona SDK by MrSubspacegames,http://www.youtube.com/watch?v=djOKIsebfw0,Miscellaneous,Video
Screencast: Crash Course to Corona by Jesse Warden,http://www.youtube.com/watch?v=CnfJqEN2bxc&feature=channel_video_title,Miscellaneous,Video
How to Build for the App Store,http://developer.anscamobile.com/forum/2011/03/13/build-app-store,Miscellaneous,Forum Post
"Provisioning, Setup & App Store Submission",http://www.slideshare.net/anscamobile/iphone-provisioning-setup-and-app-store-submission?from=ss_embed,Miscellaneous,Slideshow
Acessing SQLite Database in Corona,http://sree.cc/google/android/acessing-sqlite-database-in-corona,Miscellaneous,Blog post
Academy of Art Webinar by Adrian Herbez: Intro to Corona (Also Demos Building a Cannon Game),https://live4.academyart.edu/p88008816/?launcher=false&fcsContent=true&pbMode=normal,Miscellaneous,Webinar
Corona Tips and Tricks by @base2solutions (work in progress),http://www.base2solutions.com/walkabout/Corona%20Tips.html,Miscellaneous,Blog Post
How to Make an Angry Birds Catapult,http://developer.anscamobile.com/code/how-make-angry-birds-catapult,Miscellaneous,Forum post
Integrating Facebook Like Buttons & Corona SDK,http://www.crawlspacegames.com/blog/likey-likey-integrating-facebook-like-buttons-corona-sdk/,Miscellaneous,Blog Post
Photoshop as a Level Editor for Corona SDK,http://www.rocket5studios.com/tutorials/photoshop-as-a-level-editor-for-corona-sdk/?utm_source=feedburner&utm_medium=feed&utm_campaign=Feed%3A+idevblogaday+%28iDevBlogADay%29&utm_content=Twitter,Miscellaneous,Blog Post
Screencast: Create a Recipe App by mf2810,http://www.youtube.com/watch?v=teZ2aPuGtQA&feature=BFp&list=PL3982E4C08F7E4001&index=1,Miscellaneous,Video
Lua Switch Function Code Example,http://www.nexusgamestudio.com/2011/08/30/lua-switch-function-code-example/,Miscellaneous,Blog post
Screencast: How to Make iPad Books with Corona SDK,http://www.youtube.com/watch?v=u-AHlPY_-H0&list=PL153E4F87F6994800&index=1,Miscellaneous,Video
Create a Load Progress Bar for Corona SDK,http://ramblingprogrammer.com/?p=23,Miscellaneous,Blog post
Develop a String Avoider Prototype with Corona SDK,http://www.emanueleferonato.com/2011/12/19/develop-a-string-avoider-prototype-with-corona-sdk/,Miscellaneous,Blog post
Corona SDK: How to Get a User's Last Tweet,http://mobiledevtuts.com/corona-sdk/corona-sdk-how-to-get-a-users-last-tweet/,Miscellaneous,Blog post
Corona Level Selection Tutorial,http://www.newnams.com/corona-level-selection-tutorial/,Miscellaneous,Blog post
Corona - Arrays,http://www.webdevils.com.php5-22.dfw1-1.websitetestlink.com/?p=742,Mitchell Hudson,Blog post
Corona - for Loop,http://www.webdevils.com.php5-22.dfw1-1.websitetestlink.com/?p=752,Mitchell Hudson,Blog post
Corona Ð Display Objects,http://www.webdevils.com.php5-22.dfw1-1.websitetestlink.com/?p=757,Mitchell Hudson,Blog post
Corona Ð Animation,http://www.webdevils.com.php5-22.dfw1-1.websitetestlink.com/?p=763,Mitchell Hudson,Blog post
Corona Ð More Easing types,http://www.webdevils.com.php5-22.dfw1-1.websitetestlink.com/?p=776,Mitchell Hudson,Blog post
Lesson 01: Introduction to Corona SDK,http://mobile.tutsplus.com/tutorials/corona/introduction-to-corona-sdk-easy-cross-platform-development/,Mobiletuts+,Blog Post
Lesson 02: Creating an Analog Clock App,http://mobile.tutsplus.com/tutorials/corona/corona-sdk-creating-an-analog-clock-app/,Mobiletuts+,Blog Post
Lesson 03: Create an Accelerometer Driven Application,http://mobile.tutsplus.com/tutorials/corona/corona-sdk-accelerometer/,Mobiletuts+,Blog Post
Lesson 04: Develop an Entertaining Magic Ball Application,http://mobile.tutsplus.com/tutorials/corona/corona-sdk-eight-ball/,Mobiletuts+,Blog Post
Lesson 05: Working with Alerts,http://mobile.tutsplus.com/tutorials/corona/corona-sdk-working-with-alerts/,Mobiletuts+,Blog Post
Lesson 06: Creating an In-App Web View,http://mobile.tutsplus.com/tutorials/corona/corona-sdk-webview/,Mobiletuts+,Blog Post
Lesson 07: Creating a Simple Basketball Game,http://mobile.tutsplus.com/tutorials/corona/corona-sdk_game-development_basketball/,Mobiletuts+,Blog Post
Lesson 08: Game Development Path Finding,http://mobile.tutsplus.com/tutorials/corona/corona-sdk-game-development-path-finding/,Mobiletuts+,Blog Post
Lesson 09: Create a Screen Capture Utility,http://mobile.tutsplus.com/tutorials/corona/corona-sdk-quick-tip-create-a-screen-capture-utility/,Mobiletuts+,Blog Post
Lesson 10: Screen Transitions,http://mobile.tutsplus.com/tutorials/corona/corona-sdk_view-transitions/,Mobiletuts+,Blog Post
Lesson 11: How to Blow Stuff Up With the Physics Engine: Part 1,http://mobile.tutsplus.com/tutorials/corona/corona-sdk_physics_explosions/,Mobiletuts+,Blog Post
Lesson 12: How to Blow Stuff Up With the Physics Engine: Part 2,http://mobile.tutsplus.com/tutorials/corona/corona-sdk_physics-engine_explosions/,Mobiletuts+,Blog Post
"Lesson 13: Create a Brick Breaker Game, Part 1: Application Setup",http://mobile.tutsplus.com/tutorials/corona/corona-sdk_brick-breaker/,Mobiletuts+,Blog Post
"Lesson 14: Create a Brick Breaker Game, Part 2: Game Controls",http://mobile.tutsplus.com/tutorials/corona/create-a-brick-breaker-game-with-the-corona-sdk-game-controls/,Mobiletuts+,Blog Post
"Lesson 15: Create a Brick Breaker Game, Part 3: Collision Detection",http://mobile.tutsplus.com/tutorials/corona/create-a-brick-breaker-game-with-the-corona-sdk-collision-detection/,Mobiletuts+,Blog Post
Lesson 16: Sharing Data with Gestures: Corona App Setup,http://mobile.tutsplus.com/tutorials/corona/mobile-bump-app-1/,Mobiletuts+,Blog Post
